summary,summary_detail,id,guidislink,links,url,date,published_parsed,title,title_detail,ticker,source,text,Year,Month,Day,Weekday,text_length,word_count,title_length,title_word_count
"We recently published a list of Jim Cramer Focused On These 9 Stocks Recently. In this article, we are going to take a look at where Honeywell (NASDAQ:HON) stands against other stocks that Jim Cramer discussed recently. Jim Cramer, host of Mad Money, expressed his frustration on March 19 about how investors often get caught […]","{'type': 'text/html', 'language': None, 'base': 'https://feeds.finance.yahoo.com/rss/2.0/headline?s=HON&region=US&lang=en-US', 'value': 'We recently published a list of Jim Cramer Focused On These 9 Stocks Recently. In this article, we are going to take a look at where Honeywell (NASDAQ:HON) stands against other stocks that Jim Cramer discussed recently. Jim Cramer, host of Mad Money, expressed his frustration on March 19 about how investors often get caught […]'}",af63d260-9fb8-30ad-bba6-b1559bda2abf,False,"[{'rel': 'alternate', 'type': 'text/html', 'href': 'https://finance.yahoo.com/news/jim-cramer-honeywell-hon-aerospace-194450255.html?.tsrc=rss'}]",https://finance.yahoo.com/news/jim-cramer-honeywell-hon-aerospace-194450255.html?.tsrc=rss,2025-03-26 19:44:50,"time.struct_time(tm_year=2025, tm_mon=3, tm_mday=26, tm_hour=19, tm_min=44, tm_sec=50, tm_wday=2, tm_yday=85, tm_isdst=0)",Jim Cramer on Honeywell (HON): “Aerospace is the Growth Engine – I Own It!”,"{'type': 'text/plain', 'language': None, 'base': 'https://feeds.finance.yahoo.com/rss/2.0/headline?s=HON&region=US&lang=en-US', 'value': 'Jim Cramer on Honeywell (HON): “Aerospace is the Growth Engine – I Own It!”'}",HON,Yahoo Finance,"Jim Cramer on Honeywell (HON): “Aerospace is the Growth Engine – I Own It!” We recently published a list of Jim Cramer Focused On These 9 Stocks Recently. In this article, we are going to take a look at where Honeywell (NASDAQ:HON) stands against other stocks that Jim Cramer discussed recently. Jim Cramer, host of Mad Money, expressed his frustration on March 19 about how investors often get caught […]",2025,3,26,2,405,70,75,14
"Honeywell Aerospace Technologies' recent strategic partnership with Nokia and Numana to enhance Quantum-Safe Networks might have played a role in Honeywell International's (NasdaqGS:HON) flat price move of 0.68% last week. This collaboration aims to advance secure networking innovations and could attract positive market attention. Meanwhile, the broader market saw a 1.8% increase, benefiting from a rebound rally, while key indices like the S&amp;P 500 were slightly up, reflecting a recovery from...","{'type': 'text/html', 'language': None, 'base': 'https://feeds.finance.yahoo.com/rss/2.0/headline?s=HON&region=US&lang=en-US', 'value': ""Honeywell Aerospace Technologies' recent strategic partnership with Nokia and Numana to enhance Quantum-Safe Networks might have played a role in Honeywell International's (NasdaqGS:HON) flat price move of 0.68% last week. This collaboration aims to advance secure networking innovations and could attract positive market attention. Meanwhile, the broader market saw a 1.8% increase, benefiting from a rebound rally, while key indices like the S&amp;P 500 were slightly up, reflecting a recovery from...""}",3ef22caf-4be3-3f49-a194-582eaff8d077,False,"[{'rel': 'alternate', 'type': 'text/html', 'href': 'https://finance.yahoo.com/news/honeywell-international-nasdaqgs-hon-partners-174112066.html?.tsrc=rss'}]",https://finance.yahoo.com/news/honeywell-international-nasdaqgs-hon-partners-174112066.html?.tsrc=rss,2025-03-25 17:41:12,"time.struct_time(tm_year=2025, tm_mon=3, tm_mday=25, tm_hour=17, tm_min=41, tm_sec=12, tm_wday=1, tm_yday=84, tm_isdst=0)",Honeywell International (NasdaqGS:HON) Partners To Advance Quantum-Safe Networks In Montreal,"{'type': 'text/plain', 'language': None, 'base': 'https://feeds.finance.yahoo.com/rss/2.0/headline?s=HON&region=US&lang=en-US', 'value': 'Honeywell International (NasdaqGS:HON) Partners To Advance Quantum-Safe Networks In Montreal'}",HON,Yahoo Finance,"Honeywell International (NasdaqGS:HON) Partners To Advance Quantum-Safe Networks In Montreal Honeywell Aerospace Technologies' recent strategic partnership with Nokia and Numana to enhance Quantum-Safe Networks might have played a role in Honeywell International's (NasdaqGS:HON) flat price move of 0.68% last week. This collaboration aims to advance secure networking innovations and could attract positive market attention. Meanwhile, the broader market saw a 1.8% increase, benefiting from a rebound rally, while key indices like the S&amp;P 500 were slightly up, reflecting a recovery from...",2025,3,25,1,596,81,92,10
"Honeywell International, which announced plans last month to split into three independent companies, said Tuesday it has named David Sewell as the CEO of its advanced materials business.","{'type': 'text/html', 'language': None, 'base': 'https://feeds.finance.yahoo.com/rss/2.0/headline?s=HON&region=US&lang=en-US', 'value': 'Honeywell International, which announced plans last month to split into three independent companies, said Tuesday it has named David Sewell as the CEO of its advanced materials business.'}",3a407349-2c55-3577-ad01-a5020ffe45c6,False,"[{'rel': 'alternate', 'type': 'text/html', 'href': 'https://www.investopedia.com/honeywell-names-sewell-as-ceo-of-advanced-materials-business-11702777?.tsrc=rss'}]",https://www.investopedia.com/honeywell-names-sewell-as-ceo-of-advanced-materials-business-11702777?.tsrc=rss,2025-03-25 13:23:15,"time.struct_time(tm_year=2025, tm_mon=3, tm_mday=25, tm_hour=13, tm_min=23, tm_sec=15, tm_wday=1, tm_yday=84, tm_isdst=0)",Honeywell Names Sewell as CEO of Advanced Materials Business,"{'type': 'text/plain', 'language': None, 'base': 'https://feeds.finance.yahoo.com/rss/2.0/headline?s=HON&region=US&lang=en-US', 'value': 'Honeywell Names Sewell as CEO of Advanced Materials Business'}",HON,Yahoo Finance,"Honeywell Names Sewell as CEO of Advanced Materials Business Honeywell International, which announced plans last month to split into three independent companies, said Tuesday it has named David Sewell as the CEO of its advanced materials business.",2025,3,25,1,247,37,60,9
"The industrial giant had announced the spin-off in October as it looked to simplify its business.  The unit would be named Solstice Advanced Materials and focus exclusively on sustainable specialty chemicals and materials.  Honeywell is also set to separate its aerospace and automation businesses, splitting one of America's last standing conglomerates into three independent firms.","{'type': 'text/html', 'language': None, 'base': 'https://feeds.finance.yahoo.com/rss/2.0/headline?s=HON&region=US&lang=en-US', 'value': ""The industrial giant had announced the spin-off in October as it looked to simplify its business.  The unit would be named Solstice Advanced Materials and focus exclusively on sustainable specialty chemicals and materials.  Honeywell is also set to separate its aerospace and automation businesses, splitting one of America's last standing conglomerates into three independent firms.""}",1e2c2edf-539b-3c4c-8d27-2c3b88dc48dd,False,"[{'rel': 'alternate', 'type': 'text/html', 'href': 'https://finance.yahoo.com/news/honeywell-appoints-david-sewell-lead-110446458.html?.tsrc=rss'}]",https://finance.yahoo.com/news/honeywell-appoints-david-sewell-lead-110446458.html?.tsrc=rss,2025-03-25 11:04:46,"time.struct_time(tm_year=2025, tm_mon=3, tm_mday=25, tm_hour=11, tm_min=4, tm_sec=46, tm_wday=1, tm_yday=84, tm_isdst=0)",Honeywell appoints David Sewell to lead advanced materials unit ahead of spin-off,"{'type': 'text/plain', 'language': None, 'base': 'https://feeds.finance.yahoo.com/rss/2.0/headline?s=HON&region=US&lang=en-US', 'value': 'Honeywell appoints David Sewell to lead advanced materials unit ahead of spin-off'}",HON,Yahoo Finance,"Honeywell appoints David Sewell to lead advanced materials unit ahead of spin-off The industrial giant had announced the spin-off in October as it looked to simplify its business.  The unit would be named Solstice Advanced Materials and focus exclusively on sustainable specialty chemicals and materials.  Honeywell is also set to separate its aerospace and automation businesses, splitting one of America's last standing conglomerates into three independent firms.",2025,3,25,1,465,67,81,12
"Honeywell (Nasdaq: HON) today announced key leadership roles for its Advanced Materials business, which will be named Solstice Advanced Materials after its tax-free spin to shareholders targeted to be completed by late 2025 or early 2026. The independent company will be headquartered in Morris Plains, New Jersey.","{'type': 'text/html', 'language': None, 'base': 'https://feeds.finance.yahoo.com/rss/2.0/headline?s=HON&region=US&lang=en-US', 'value': 'Honeywell (Nasdaq: HON) today announced key leadership roles for its Advanced Materials business, which will be named Solstice Advanced Materials after its tax-free spin to shareholders targeted to be completed by late 2025 or early 2026. The independent company will be headquartered in Morris Plains, New Jersey.'}",f5d8758a-e243-33af-badd-5ac54e999083,False,"[{'rel': 'alternate', 'type': 'text/html', 'href': 'https://finance.yahoo.com/news/honeywell-announces-leadership-team-company-110000314.html?.tsrc=rss'}]",https://finance.yahoo.com/news/honeywell-announces-leadership-team-company-110000314.html?.tsrc=rss,2025-03-25 11:00:00,"time.struct_time(tm_year=2025, tm_mon=3, tm_mday=25, tm_hour=11, tm_min=0, tm_sec=0, tm_wday=1, tm_yday=84, tm_isdst=0)",HONEYWELL ANNOUNCES LEADERSHIP TEAM AND COMPANY NAME FOR ADVANCED MATERIALS SPIN-OFF,"{'type': 'text/plain', 'language': None, 'base': 'https://feeds.finance.yahoo.com/rss/2.0/headline?s=HON&region=US&lang=en-US', 'value': 'HONEYWELL ANNOUNCES LEADERSHIP TEAM AND COMPANY NAME FOR ADVANCED MATERIALS SPIN-OFF'}",HON,Yahoo Finance,"HONEYWELL ANNOUNCES LEADERSHIP TEAM AND COMPANY NAME FOR ADVANCED MATERIALS SPIN-OFF Honeywell (Nasdaq: HON) today announced key leadership roles for its Advanced Materials business, which will be named Solstice Advanced Materials after its tax-free spin to shareholders targeted to be completed by late 2025 or early 2026. The independent company will be headquartered in Morris Plains, New Jersey.",2025,3,25,1,399,58,84,11
"The latest trading day saw Honeywell International Inc. (HON) settling at $211.85, representing a +0.82% change from its previous close.","{'type': 'text/html', 'language': None, 'base': 'https://feeds.finance.yahoo.com/rss/2.0/headline?s=HON&region=US&lang=en-US', 'value': 'The latest trading day saw Honeywell International Inc. (HON) settling at $211.85, representing a +0.82% change from its previous close.'}",fbf36361-4e33-37a3-a98b-6bd86ec41566,False,"[{'rel': 'alternate', 'type': 'text/html', 'href': 'https://finance.yahoo.com/news/honeywell-international-inc-hon-rises-221511441.html?.tsrc=rss'}]",https://finance.yahoo.com/news/honeywell-international-inc-hon-rises-221511441.html?.tsrc=rss,2025-03-24 22:15:11,"time.struct_time(tm_year=2025, tm_mon=3, tm_mday=24, tm_hour=22, tm_min=15, tm_sec=11, tm_wday=0, tm_yday=83, tm_isdst=0)",Honeywell International Inc. (HON) Rises But Trails Market: What Investors Should Know,"{'type': 'text/plain', 'language': None, 'base': 'https://feeds.finance.yahoo.com/rss/2.0/headline?s=HON&region=US&lang=en-US', 'value': 'Honeywell International Inc. (HON) Rises But Trails Market: What Investors Should Know'}",HON,Yahoo Finance,"Honeywell International Inc. (HON) Rises But Trails Market: What Investors Should Know The latest trading day saw Honeywell International Inc. (HON) settling at $211.85, representing a +0.82% change from its previous close.",2025,3,24,0,223,32,86,12
